Cluster Name,Client,Current Number Of Pages In Cluster,Target N째 Of Pages For High Strength,Target N째 Of Pages For Medium Strength,Target N째 Of Pages For Low Strength,Target Cluster Strength,Missing N째 Pages To Achieve High Strength,Growth Model Pages In Cluster,Target Keywords
SEO Strategy,Example Client,5,12,8,4,High,7,3,"seo strategy guide, seo strategy 2024, b2b seo strategy, enterprise seo strategy"
Technical SEO,Example Client,8,15,10,5,High,7,4,"technical seo services, technical seo audit, site speed optimization, schema markup"
E-commerce,Example Client,6,10,7,4,Medium,4,2,"ecommerce seo case study, ecommerce seo services, product page optimization"
Local SEO,Example Client,3,8,5,3,Medium,5,1,"local seo guide, local business seo, google business profile optimization"
Content Marketing,Example Client,7,12,8,4,Medium,5,3,"content marketing services, content strategy, blog optimization, content audit"
