Title,Client,SEO Strategist,Due Date,Document Link,Month,Status,Content Writer,Content Editor,Frase Document Link,Target Keywords,Word Count Target
The Future of Remote Work,Example Client,John Smith,2024-04-10,https://docs.google.com/document/d/1,April,In Progress,Alex Johnson,Jane Doe,https://app.frase.io/documents/12345,"remote work trends, future of remote work, remote work statistics",1500
SEO Best Practices,Example Client,Jane Doe,2024-04-14,https://docs.google.com/document/d/2,April,Needs Input,Sarah Williams,John Smith,https://app.frase.io/documents/23456,"seo best practices, seo tips 2024, seo strategy",1200
Content Marketing Guide,Example Client,Alex Johnson,2024-04-07,https://docs.google.com/document/d/3,April,Review Brief,Michael Brown,Jane Doe,https://app.frase.io/documents/34567,"content marketing guide, content strategy, content marketing tips",1700
Local SEO Strategies,Example Client,John Smith,2024-04-20,https://docs.google.com/document/d/4,April,Brief Approved,Emily Davis,Alex Johnson,https://app.frase.io/documents/45678,"local seo strategies, local business seo, google business profile",1600
E-Commerce Trends,Example Client,Jane Doe,2024-04-25,https://docs.google.com/document/d/5,April,In Progress,Robert Wilson,John Smith,https://app.frase.io/documents/56789,"ecommerce trends 2024, online shopping statistics, ecommerce growth",1800
